{"actions": [], "assumptions": [], "decisions": [], "dependencies": [], "evidence": [], "failures": [], "goal": "write benchmarks/REFERENCE.md with index size, skill-rules hash, model versions, vectors digest, commit hash", "id": "P0-1", "inputs": [], "known_facts": ["router at src/steroids/router.py"], "memory_updates": [], "parent": "S-00", "questions": [{"answer": "1265", "question": "current index size?"}], "required_context": [], "status": "completed", "title": "Record environment snapshot", "unknowns": [], "verification": ["cat benchmarks/REFERENCE.md", "sha256sum skill-rules.json", "python3 src/steroids/router.py --count"]}