{"actions": [], "assumptions": [{"confidence": "high", "statement": "clean env per trial prevents state leakage", "status": "verified"}, {"confidence": "medium", "statement": "2 sample tasks predict full-bank harness behavior", "status": "unverified"}], "decisions": [], "dependencies": ["P0-2", "P0-3"], "evidence": [{"claim": "trial policy works", "kind": "verified-fact", "source": "tests/benchmark.py --trials 3 PASS"}], "failures": [], "goal": "run identical bank MODEL-only vs MODEL+STEROIDS with per-task metrics CSV", "id": "P0-4", "inputs": ["specs/phase-0/task-bank.md"], "known_facts": ["golden snapshot frozen"], "memory_updates": [], "parent": "S-00", "questions": [{"answer": null, "question": "which 2 sample tasks prove the harness end-to-end?"}], "required_context": ["benchmarks/REFERENCE.md"], "status": "blocked", "title": "Paired harness MODEL vs MODEL+STEROIDS", "unknowns": ["task bank P0-3 not collected yet"], "verification": ["run harness on 2 sample tasks end-to-end", "inspect CSV columns"]}