[{"goal": "write benchmarks/REFERENCE.md with index size, skill-rules hash, model versions, vectors digest, commit hash", "id": "P0-1", "status": "completed", "title": "Record environment snapshot"}, {"goal": "benchmark.py gains --trials N; every number carries a 95% bootstrap CI; golden re-measured", "id": "P0-2", "status": "completed", "title": "Trial policy in bench"}, {"goal": "bank 20 tasks from actual failures/sessions with reference solutions or deterministic graders", "id": "P0-3", "status": "pending", "title": "Collect 20 real tasks"}, {"goal": "run identical bank MODEL-only vs MODEL+STEROIDS with per-task metrics CSV", "id": "P0-4", "status": "pending", "title": "Paired harness MODEL vs MODEL+STEROIDS"}, {"goal": "analyze results with CIs; record go/simplify/stop with numbers", "id": "P0-5", "status": "pending", "title": "Baseline report + kill evaluation"}, {"goal": "codify outputs-not-paths, partial credit, reference solutions, calibration into harness + template", "id": "P0-6", "status": "pending", "title": "Grader rules adopted"}]